{
  "schema": 1,
  "schema_path": "features/integration-receipt.schema.json",
  "receipt_path": ".agent-app-features/feedback.json",
  "state": "active",
  "source": {
    "repository": "timmyagentic/awesome-agent-app-features",
    "resolved_commit": "7fd66c9f25111e1fe6564b36a477e16c78f831d8",
    "ci_run_url": "https://github.com/timmyagentic/awesome-agent-app-features/actions/runs/32696109732",
    "ci_conclusion": "success",
    "entry_path": "features/index.json",
    "manifest_path": "features/feedback/feature.json"
  },
  "feature": {
    "id": "feedback",
    "contract": "v1",
    "release_status": "unreleased",
    "since": null
  },
  "host": {
    "root": ".",
    "runtime": ["go", "cloudflare-worker"],
    "entry_points": ["feedback command", "user-visible error prompt"],
    "configuration_keys": ["feedback.enabled", "feedback.endpoint"]
  },
  "deliveries": [
    {
      "mode": "go-module",
      "source": "github.com/timmyagentic/awesome-agent-app-features/feedback",
      "target": "go.mod",
      "resolved_version": "v0.0.0-20260824060835-7fd66c9f2511"
    },
    {
      "mode": "go-module",
      "source": "github.com/timmyagentic/awesome-agent-app-features/feedback/httpclient",
      "target": "go.mod",
      "resolved_version": "v0.0.0-20260824060835-7fd66c9f2511"
    },
    {
      "mode": "source-subtree",
      "source": "relay/cloudflare",
      "target": "infrastructure/feedback-relay"
    }
  ],
  "artifacts": [
    {
      "path": "internal/feedback/flow.go",
      "ownership": "integration-managed",
      "role": "Host preview, approval, and submission adapter.",
      "removal": "candidate"
    },
    {
      "path": "internal/feedback/flow_test.go",
      "ownership": "integration-managed",
      "role": "Host approval, redaction, and failure regression tests.",
      "removal": "candidate"
    },
    {
      "path": "infrastructure/feedback-relay",
      "ownership": "integration-managed",
      "role": "Host-owned copy of the declared relay source subtree.",
      "removal": "candidate"
    },
    {
      "path": "go.mod",
      "ownership": "host-shared",
      "role": "Host dependency manifest shared with the rest of the product.",
      "removal": "retain"
    }
  ],
  "invariants": [
    {
      "invariant": "There is one feedback shape; errors and capability gaps are optional context, not categories.",
      "status": "preserved",
      "evidence": "One host adapter builds feedback.Input with optional recent error and capability gaps."
    },
    {
      "invariant": "No report is submitted in the background or before an explicit user action.",
      "status": "preserved",
      "evidence": "Cancellation and preview tests observe zero HTTP requests before the second action."
    },
    {
      "invariant": "Every outbound free-text field is redacted and bounded before approval.",
      "status": "preserved",
      "evidence": "Host tests cover default and product-specific redaction before Draft.Approve."
    },
    {
      "invariant": "Draft.Report is a deep-copied preview and cannot be JSON-marshaled; only opaque Approved emits Feedback v1 JSON.",
      "status": "preserved",
      "evidence": "Preview equivalence and serialization refusal are asserted by focused tests."
    },
    {
      "invariant": "The core payload contains structured report data and no issue title, Markdown body, card, or localized presentation.",
      "status": "preserved",
      "evidence": "Presentation exists only in the host adapter; the foundation payload remains structured."
    },
    {
      "invariant": "Automatically captured environment data is a fixed allowlist.",
      "status": "preserved",
      "evidence": "The host maps only product, version, OS, architecture, and agent."
    },
    {
      "invariant": "The provided HTTP client never follows redirects for an approved feedback POST.",
      "status": "preserved",
      "evidence": "The host uses feedback/httpclient.Client without a second transport."
    },
    {
      "invariant": "The provided HTTP client and reference relay use only POST /v1/feedback for wire schema 1.",
      "status": "preserved",
      "evidence": "Endpoint configuration and transport tests use the exact v1 path."
    },
    {
      "invariant": "The client has no GitHub token and cannot select the relay target repository.",
      "status": "preserved",
      "evidence": "Client configuration contains only the relay endpoint; repository and token remain server-side."
    },
    {
      "invariant": "The relay validates schema, approval, fields, and byte limits again.",
      "status": "preserved",
      "evidence": "The pinned relay subtree and source CI include strict schema and workerd tests."
    }
  ],
  "verification": [
    {
      "scope": "remote",
      "check": "Run the exact-source external consumer contract.",
      "status": "passed",
      "evidence": "Source CI run 32696109732 passed the no-checkout remote consumer.",
      "at": "2026-08-24T06:08:35Z"
    },
    {
      "scope": "foundation",
      "check": "Verify Feedback core, HTTP client, relay schema, and workerd runtime.",
      "status": "passed",
      "evidence": "Source CI run 32696109732 completed successfully.",
      "at": "2026-08-24T06:08:35Z"
    },
    {
      "scope": "host",
      "check": "Run focused Feedback adapter tests and the host's complete normal verification.",
      "status": "passed",
      "evidence": "Illustrative host evidence: focused and full suites completed without failures.",
      "at": "2026-08-24T06:08:35Z"
    },
    {
      "scope": "production",
      "check": "Create one live downstream issue through production credentials.",
      "status": "unverified",
      "evidence": "Production deployment and credentials were outside the illustrative integration scope.",
      "at": "2026-08-24T06:08:35Z"
    }
  ],
  "unverified": [
    {
      "boundary": "Production relay and real downstream issue creation.",
      "reason": "Production credentials and deployment require separate authorization."
    }
  ],
  "history": [
    {
      "action": "integrate",
      "from_commit": null,
      "to_commit": "7fd66c9f25111e1fe6564b36a477e16c78f831d8",
      "at": "2026-08-24T06:08:35Z",
      "summary": "Integrated Feedback core, HTTPS client, host adapter, and relay subtree."
    }
  ],
  "removal": {
    "status": "not-requested",
    "removed_paths": [],
    "retained_paths": [],
    "evidence": "No removal has been requested."
  },
  "updated_at": "2026-08-24T06:08:35Z"
}
